{
  "paper_id": "05",
  "title": "Exact Las Vegas query costs for purification with state-generating oracles",
  "source_url": "https://liuchliuch.github.io/repository/exact-las-vegas-query-costs-for-purification-with-state-generating-oracles/",
  "lean_toolchain": "leanprover/lean4:v4.24.0",
  "production_roots": [
    "ELV"
  ],
  "build_targets": [
    "ELV",
    "Verification.Solution",
    "Verification.Challenge",
    "Verification.Audit"
  ],
  "comparators": [
    {
      "id": "main",
      "config": "Verification/comparator.json",
      "expected_rejection": null,
      "scope": "Eighteen fixed explicit targets, including full operational Theorem 1.1, all numbered results, four-query circuit and introduction consequences."
    },
    {
      "id": "negative-premise",
      "config": "Verification/negative-premise.json",
      "expected_rejection": "type",
      "scope": "The complete operational minimax and attainment contract is weakened by a False premise. Rejection detail: extra False premise on Verification.Certificate.thm11_full."
    },
    {
      "id": "negative-axiom",
      "config": "Verification/negative-axiom.json",
      "expected_rejection": "axiom",
      "scope": "The complete operational main theorem is intentionally proved through an unauthorized axiom. Rejection detail: unauthorized_full axiom."
    }
  ],
  "main_results": [
    {
      "source_result": "Theorem 1.1",
      "declaration": "ELV.theorem11_full",
      "scope": "For every nonzero finite workspace and 0 < delta < 1/2, unrestricted minimax value is 1/(2*delta), admissible value is 1/(1 − sqrt(1 − 4*delta²)), and both have separable attainments."
    },
    {
      "source_result": "Lemma 2.1",
      "declaration": "ELV.Gram.stabilized_realization_full",
      "scope": "Equal-Gram families over arbitrary index types in complete complex Hilbert spaces admit a stabilized unitary, with the exact Hilbert-basis cardinal and separability consequence."
    },
    {
      "source_result": "Remark 2.2",
      "declaration": "ELV.Query.bilateralShift_no_transduction",
      "scope": "The bilateral shift has no square-summable orthogonal returned catalyst for the stated public input/output equation."
    },
    {
      "source_result": "Lemma 3.1",
      "declaration": "ELV.Line.line_purifier_public",
      "scope": "One fixed line circuit has the stated returned geometric catalyst, executed query cost, and catalyst norm; both endpoints admit zero catalysts."
    },
    {
      "source_result": "Proposition 4.1",
      "declaration": "ELV.Costs.admissible_adversary_twoSpaces",
      "scope": "Admissible operational value equals the signed-Gram infimum over separately chosen complete forward/inverse spaces, with extraction and converse realization."
    },
    {
      "source_result": "Proposition 4.2",
      "declaration": "ELV.Costs.oneDirection_optimum_infinite",
      "scope": "Forbidding either query direction forces infinite uniform cost for every admissible exact circuit and for the corresponding minimax value."
    },
    {
      "source_result": "Four-query construction and (3.11)",
      "declaration": "ELV.FourQuery.catalyst_bound",
      "scope": "Gap-independent four-query circuit returns its catalyst, attains the unrestricted optimum, and satisfies the catalyst bound including endpoint oracle probabilities."
    },
    {
      "source_result": "Introduction direct consequences",
      "declaration": "ELV.Costs.costs_dimension_independent",
      "scope": "Minimax values are independent of nonzero workspace dimension; the quarter-gap values and uniform O(delta²) asymptotic remainder are explicit."
    }
  ],
  "preparation": [],
  "external_dependencies": "EXTERNAL_DEPENDENCIES.md",
  "primary_comparator": "main"
}
